{
  "baseline_validation": {
    "step11b_report": {
      "expected": true,
      "metric": "overall_passed",
      "observed": true,
      "passed": true
    },
    "step11c_report": {
      "expected": true,
      "metric": "overall_passed",
      "observed": true,
      "passed": true
    },
    "step11d_report": {
      "expected": true,
      "metric": "overall_passed",
      "observed": true,
      "passed": true
    },
    "step11e_report": {
      "expected": true,
      "metric": "overall_passed",
      "observed": true,
      "passed": true
    }
  },
  "catalog": {
    "catalog_id": "AEGIS-COMPOUND-ATTACK-CHAIN-CATALOG",
    "harness_version": "1.0.0",
    "relative_path": "policies/assurance/compound_attack_chain_catalog_v1.yaml",
    "sha256": "4176dca2bcbad26f49c1d062e73c940a8b46aef478c38ac4ab10cc798aaa0a6f",
    "version": "1.0.0"
  },
  "generated_at": "2026-07-14T16:30:46.116312+00:00",
  "harness_error_chain_ids": [],
  "input_integrity_checks_after": {
    "assurance_corpus": {
      "actual_sha256": "d51747056c4f920d5e0b6bfb51613b4e1ee1910de82770aa179dd3fe77f68ded",
      "exists": true,
      "expected_sha256": "d51747056c4f920d5e0b6bfb51613b4e1ee1910de82770aa179dd3fe77f68ded",
      "passed": true,
      "relative_path": "data/assurance/step11a_policy_rule_coverage_corpus.jsonl",
      "safe_path": true
    },
    "assurance_manifest": {
      "actual_sha256": "d1fdd9308b973e5248e464daf528a376bca6bc6c27b9d45f267b88f842797465",
      "exists": true,
      "expected_sha256": "d1fdd9308b973e5248e464daf528a376bca6bc6c27b9d45f267b88f842797465",
      "passed": true,
      "relative_path": "data/assurance/step11a_policy_rule_coverage_manifest.json",
      "safe_path": true
    },
    "decision_policy": {
      "actual_sha256": "fd5f39cec54f4bb57491d60bff9326f9b854209d3ab907cdab8768029a35447f",
      "exists": true,
      "expected_sha256": "fd5f39cec54f4bb57491d60bff9326f9b854209d3ab907cdab8768029a35447f",
      "passed": true,
      "relative_path": "policies/decision/federal_base_policy_v1.yaml",
      "safe_path": true
    },
    "hostile_catalog": {
      "actual_sha256": "c3ebeeae727c8613b76605edaf12912d1b9b5575f197a0dff03dd9e34b278ecb",
      "exists": true,
      "expected_sha256": "c3ebeeae727c8613b76605edaf12912d1b9b5575f197a0dff03dd9e34b278ecb",
      "passed": true,
      "relative_path": "policies/assurance/hostile_input_catalog_v1.yaml",
      "safe_path": true
    },
    "hostile_module": {
      "actual_sha256": "a216dcb72d589616554cb69e948be7b534d704d8314f63c84d1617ba05db091b",
      "exists": true,
      "expected_sha256": "a216dcb72d589616554cb69e948be7b534d704d8314f63c84d1617ba05db091b",
      "passed": true,
      "relative_path": "src/assurance/hostile_input_assurance.py",
      "safe_path": true
    },
    "metamorphic_catalog": {
      "actual_sha256": "d5f5be9616f1bbe97775d94e10b9699c31a0a4db6f449dac7687b2a3f38cc175",
      "exists": true,
      "expected_sha256": "d5f5be9616f1bbe97775d94e10b9699c31a0a4db6f449dac7687b2a3f38cc175",
      "passed": true,
      "relative_path": "policies/assurance/metamorphic_relation_catalog_v1.yaml",
      "safe_path": true
    },
    "metamorphic_module": {
      "actual_sha256": "8b27961efe2db50e52d1e57b86bc20f771802e5e5e254e20f8d90a52ed0f993b",
      "exists": true,
      "expected_sha256": "8b27961efe2db50e52d1e57b86bc20f771802e5e5e254e20f8d90a52ed0f993b",
      "passed": true,
      "relative_path": "src/assurance/metamorphic_assurance.py",
      "safe_path": true
    },
    "mutation_catalog": {
      "actual_sha256": "e8e050967e9aa6bc4be096745bae5c384d88b861116fb7df37868132741b17e9",
      "exists": true,
      "expected_sha256": "e8e050967e9aa6bc4be096745bae5c384d88b861116fb7df37868132741b17e9",
      "passed": true,
      "relative_path": "policies/assurance/policy_mutation_catalog_v1.yaml",
      "safe_path": true
    },
    "policy_mutation_module": {
      "actual_sha256": "e08f8a948104d462a12d9b2e114c0fc4219227bb68c6966e94a12974416f39ca",
      "exists": true,
      "expected_sha256": "e08f8a948104d462a12d9b2e114c0fc4219227bb68c6966e94a12974416f39ca",
      "passed": true,
      "relative_path": "src/assurance/policy_mutation.py",
      "safe_path": true
    },
    "step11b_report": {
      "actual_sha256": "73365a05f63fe4ee0cf51fed471c8a3846679f4ae737cc033be670220de5ceb1",
      "exists": true,
      "expected_sha256": "73365a05f63fe4ee0cf51fed471c8a3846679f4ae737cc033be670220de5ceb1",
      "passed": true,
      "relative_path": "data/validation_reports/mutation/step11b_policy_mutation_report.json",
      "safe_path": true
    },
    "step11c_report": {
      "actual_sha256": "74f0849ee40aa73f09b9abf23929bbaf4a355d51f00c9b01958b01f943867a23",
      "exists": true,
      "expected_sha256": "74f0849ee40aa73f09b9abf23929bbaf4a355d51f00c9b01958b01f943867a23",
      "passed": true,
      "relative_path": "data/validation_reports/tampering/step11c_tamper_assurance_report.json",
      "safe_path": true
    },
    "step11d_report": {
      "actual_sha256": "8c21529e07fa9b9b196a002d64fa302e7f9ec10da3e1fec9b7070bdd6d6b6f69",
      "exists": true,
      "expected_sha256": "8c21529e07fa9b9b196a002d64fa302e7f9ec10da3e1fec9b7070bdd6d6b6f69",
      "passed": true,
      "relative_path": "data/validation_reports/hostile_inputs/step11d_hostile_input_report.json",
      "safe_path": true
    },
    "step11e_report": {
      "actual_sha256": "18c1b8986c318a815d5d954df2686846b5d97ac30727fb94c24ac72e635e652e",
      "exists": true,
      "expected_sha256": "18c1b8986c318a815d5d954df2686846b5d97ac30727fb94c24ac72e635e652e",
      "passed": true,
      "relative_path": "data/validation_reports/metamorphic/step11e_metamorphic_assurance_report.json",
      "safe_path": true
    },
    "tamper_catalog": {
      "actual_sha256": "572acb31d30d4ff34b887a86c73b2f07714eb015af833d2b715da9ab239e6a24",
      "exists": true,
      "expected_sha256": "572acb31d30d4ff34b887a86c73b2f07714eb015af833d2b715da9ab239e6a24",
      "passed": true,
      "relative_path": "policies/assurance/tamper_scenario_catalog_v1.yaml",
      "safe_path": true
    },
    "tamper_module": {
      "actual_sha256": "2fd8a7e77075b90fb1ffe60aac797e26c382a399caf283082475d620f00d2370",
      "exists": true,
      "expected_sha256": "2fd8a7e77075b90fb1ffe60aac797e26c382a399caf283082475d620f00d2370",
      "passed": true,
      "relative_path": "src/assurance/tamper_assurance.py",
      "safe_path": true
    }
  },
  "input_integrity_checks_before": {
    "assurance_corpus": {
      "actual_sha256": "d51747056c4f920d5e0b6bfb51613b4e1ee1910de82770aa179dd3fe77f68ded",
      "exists": true,
      "expected_sha256": "d51747056c4f920d5e0b6bfb51613b4e1ee1910de82770aa179dd3fe77f68ded",
      "passed": true,
      "relative_path": "data/assurance/step11a_policy_rule_coverage_corpus.jsonl",
      "safe_path": true
    },
    "assurance_manifest": {
      "actual_sha256": "d1fdd9308b973e5248e464daf528a376bca6bc6c27b9d45f267b88f842797465",
      "exists": true,
      "expected_sha256": "d1fdd9308b973e5248e464daf528a376bca6bc6c27b9d45f267b88f842797465",
      "passed": true,
      "relative_path": "data/assurance/step11a_policy_rule_coverage_manifest.json",
      "safe_path": true
    },
    "decision_policy": {
      "actual_sha256": "fd5f39cec54f4bb57491d60bff9326f9b854209d3ab907cdab8768029a35447f",
      "exists": true,
      "expected_sha256": "fd5f39cec54f4bb57491d60bff9326f9b854209d3ab907cdab8768029a35447f",
      "passed": true,
      "relative_path": "policies/decision/federal_base_policy_v1.yaml",
      "safe_path": true
    },
    "hostile_catalog": {
      "actual_sha256": "c3ebeeae727c8613b76605edaf12912d1b9b5575f197a0dff03dd9e34b278ecb",
      "exists": true,
      "expected_sha256": "c3ebeeae727c8613b76605edaf12912d1b9b5575f197a0dff03dd9e34b278ecb",
      "passed": true,
      "relative_path": "policies/assurance/hostile_input_catalog_v1.yaml",
      "safe_path": true
    },
    "hostile_module": {
      "actual_sha256": "a216dcb72d589616554cb69e948be7b534d704d8314f63c84d1617ba05db091b",
      "exists": true,
      "expected_sha256": "a216dcb72d589616554cb69e948be7b534d704d8314f63c84d1617ba05db091b",
      "passed": true,
      "relative_path": "src/assurance/hostile_input_assurance.py",
      "safe_path": true
    },
    "metamorphic_catalog": {
      "actual_sha256": "d5f5be9616f1bbe97775d94e10b9699c31a0a4db6f449dac7687b2a3f38cc175",
      "exists": true,
      "expected_sha256": "d5f5be9616f1bbe97775d94e10b9699c31a0a4db6f449dac7687b2a3f38cc175",
      "passed": true,
      "relative_path": "policies/assurance/metamorphic_relation_catalog_v1.yaml",
      "safe_path": true
    },
    "metamorphic_module": {
      "actual_sha256": "8b27961efe2db50e52d1e57b86bc20f771802e5e5e254e20f8d90a52ed0f993b",
      "exists": true,
      "expected_sha256": "8b27961efe2db50e52d1e57b86bc20f771802e5e5e254e20f8d90a52ed0f993b",
      "passed": true,
      "relative_path": "src/assurance/metamorphic_assurance.py",
      "safe_path": true
    },
    "mutation_catalog": {
      "actual_sha256": "e8e050967e9aa6bc4be096745bae5c384d88b861116fb7df37868132741b17e9",
      "exists": true,
      "expected_sha256": "e8e050967e9aa6bc4be096745bae5c384d88b861116fb7df37868132741b17e9",
      "passed": true,
      "relative_path": "policies/assurance/policy_mutation_catalog_v1.yaml",
      "safe_path": true
    },
    "policy_mutation_module": {
      "actual_sha256": "e08f8a948104d462a12d9b2e114c0fc4219227bb68c6966e94a12974416f39ca",
      "exists": true,
      "expected_sha256": "e08f8a948104d462a12d9b2e114c0fc4219227bb68c6966e94a12974416f39ca",
      "passed": true,
      "relative_path": "src/assurance/policy_mutation.py",
      "safe_path": true
    },
    "step11b_report": {
      "actual_sha256": "73365a05f63fe4ee0cf51fed471c8a3846679f4ae737cc033be670220de5ceb1",
      "exists": true,
      "expected_sha256": "73365a05f63fe4ee0cf51fed471c8a3846679f4ae737cc033be670220de5ceb1",
      "passed": true,